{
  "$schema": "https://json-schema.org/draft/2020-12/schema",
  "title": "Humanifest project record",
  "type": "object",
  "required": [
    "id",
    "name",
    "repository",
    "homepage",
    "license",
    "humanitarian_domain",
    "impact_evidence",
    "maintenance",
    "contribution",
    "sources"
  ],
  "properties": {
    "id": {
      "type": "string",
      "pattern": "\\S"
    },
    "name": {
      "type": "string",
      "pattern": "\\S"
    },
    "repository": {
      "type": "string",
      "pattern": "\\S"
    },
    "homepage": {
      "type": "string",
      "pattern": "\\S"
    },
    "license": {
      "type": "string",
      "pattern": "\\S"
    },
    "humanitarian_domain": {
      "type": "string",
      "pattern": "\\S"
    },
    "impact_evidence": {
      "type": "array",
      "items": {
        "$ref": "#/$defs/evidence"
      }
    },
    "maintenance": {
      "type": "object"
    },
    "contribution": {
      "type": "object"
    },
    "sources": {
      "type": "array",
      "minItems": 1,
      "items": {
        "$ref": "#/$defs/source"
      }
    },
    "review_organization": {
      "type": "string",
      "pattern": "\\S",
      "description": "Stable review-organization key shared by all projects of one organization; overrides GitHub owner grouping. Required for non-GitHub projects with open PRs."
    }
  },
  "additionalProperties": true,
  "$defs": {
    "source": {
      "type": "object",
      "required": [
        "id",
        "url",
        "accessed"
      ],
      "properties": {
        "id": {
          "type": "string",
          "pattern": "\\S"
        },
        "url": {
          "type": "string",
          "pattern": "^(https?://[^/\\s?#]+|file://(/|localhost/))\\S*$"
        },
        "accessed": {
          "type": "string",
          "format": "date",
          "pattern": "^\\d{4}-\\d{2}-\\d{2}$"
        }
      }
    },
    "evidence": {
      "type": "object",
      "required": [
        "type",
        "claim",
        "source_id"
      ],
      "properties": {
        "type": {
          "enum": [
            "measured",
            "modeled",
            "self_reported",
            "inferred"
          ]
        },
        "claim": {
          "type": "string",
          "pattern": "\\S"
        },
        "source_id": {
          "type": "string",
          "pattern": "\\S"
        }
      }
    }
  }
}
