{
  "id": "ifrc-pystac-monty",
  "name": "IFRC Montandon PySTAC extension",
  "repository": "https://github.com/IFRCGo/pystac-monty",
  "homepage": "https://ifrcgo.org/monty-stac-extension/",
  "license": "Apache-2.0 declared in README, manifest and license notice; full linked terms not yet reviewed",
  "humanitarian_domain": "Disaster hazard and impact data integration for humanitarian analysis",
  "impact_evidence": [
    {
      "type": "self_reported",
      "claim": "IFRC identifies Montandon as the data source for disaster-trend analysis in World Disasters Report 2026 Annex 2. This supports operational relevance, not realized impact of a proposed library change.",
      "source_id": "ifrc-use"
    }
  ],
  "maintenance": {
    "default_branch": "main",
    "inspected_tree_revision": "7dd2d48cd599c3e0b894f1676b5de88c19028c46",
    "current_public_activity": "Unarchived; pushed_at 2026-09-08T19:57:02Z. Retrieved recursive tree was not truncated."
  },
  "contribution": {
    "pathway": "README welcomes issues and pull requests and documents pytest with recorded HTTP cassettes. Setup instructions read but not executed.",
    "ai_policy": "No explicit policy established from retrieved README and tree; remaining repository/organization policy review required.",
    "maintainer_check_required": true
  },
  "sources": [
    {
      "id": "ifrc-use",
      "url": "https://wdr26.org/en/reports/wdr26/annex2",
      "accessed": "2026-09-08"
    },
    {
      "id": "monty-repo",
      "url": "https://api.github.com/repos/IFRCGo/pystac-monty",
      "accessed": "2026-09-08"
    },
    {
      "id": "monty-readme",
      "url": "https://github.com/IFRCGo/pystac-monty/blob/7dd2d48cd599c3e0b894f1676b5de88c19028c46/README.md",
      "accessed": "2026-09-08"
    },
    {
      "id": "monty-license",
      "url": "https://github.com/IFRCGo/pystac-monty/blob/7dd2d48cd599c3e0b894f1676b5de88c19028c46/LICENSE",
      "accessed": "2026-09-08"
    },
    {
      "id": "monty-manifest",
      "url": "https://github.com/IFRCGo/pystac-monty/blob/7dd2d48cd599c3e0b894f1676b5de88c19028c46/pyproject.toml",
      "accessed": "2026-09-08"
    },
    {
      "id": "monty-tree",
      "url": "https://api.github.com/repos/IFRCGo/pystac-monty/git/trees/7dd2d48cd599c3e0b894f1676b5de88c19028c46?recursive=1",
      "accessed": "2026-09-08"
    }
  ]
}
